<!DOCTYPE pages SYSTEM "../../../structure.dtd">

<pages>
    <page title="Introdução" path="introducao/introducao.md"></page>
    <page title="Primeiro programa" path="primeiro_programa/primeiro_programa.md"></page>
    <page title="Diretiva #include" path="diretiva_include/diretiva_include.md"></page>
    <page title="Funções" path="funcoes/funcoes.md"></page>
    <page title="Variáveis" path="variaveis/variaveis.md"></page>
    <page title="Tipos fundamentais básicos" path="tipos/tipos.md"></page>
    <page title="Tabelas de tipos fundamentais" path="tipos/tabelas.md"></page>
    <page title="Saída básica" path="entrada_e_saida/saida.md"></page>
</pages>
